{
  "id": "release_candidate_gate",
  "name": "Release Candidate Gate",
  "owner_agent": "safety_agent",
  "description": "Aggregate consolidated skill results and block promotion if any release-blocking skill or required subcheck failed.",
  "implementation": "release_candidate_gate",
  "depends_on": ["project_preflight", "regression_evaluation"],
  "inputs": ["skill_results", "subcheck_results"],
  "outputs": ["release_gate_review.json", "result.json"],
  "validators": [
    "all required release-blocking skills must pass or have explicit waivers",
    "release-candidate profile must enforce held-out data, physics SysID, user policy artifacts, and Isaac Lab rollout evidence",
    "safe_to_autorun_robot must always be false",
    "human approvals must be listed for hardware-facing skills"
  ],
  "quality_gate": {"min_score": 0.9},
  "human_required": true,
  "release_blocking": true,
  "real_robot": false
}
