{
  "id": "env_preflight",
  "name": "Environment Preflight",
  "owner_agent": "orchestrator_agent",
  "description": "Check local command availability before any tutorial or validation step runs.",
  "implementation": "env_preflight",
  "depends_on": [],
  "inputs": ["config"],
  "outputs": ["preflight.json", "result.json"],
  "validators": [
    "python3 must be available",
    "missing ROS tools are warnings in offline harness and blockers only for hardware release"
  ],
  "quality_gate": {"min_score": 0.7},
  "human_required": false,
  "release_blocking": true,
  "real_robot": false
}
