{
  "id": "newton_sysid",
  "name": "Newton SysID Adapter",
  "owner_agent": "sysid_agent",
  "description": "Optional portable IsaacLab-Newton SysID boundary that consumes canonical aligned records and emits fitted parameters plus residual evidence.",
  "implementation": "newton_sysid",
  "depends_on": ["sysid_step_response"],
  "inputs": ["aligned_records", "config.sysid", "previous_sysid_result"],
  "outputs": ["newton_sysid.json", "newton_command_log.json", "result.json"],
  "validators": [
    "Newton command must consume canonical aligned records instead of embodiment-specific raw logs",
    "fitted parameters and residual metrics must be written as JSON evidence when Newton is enabled",
    "local log-based SysID remains the fallback when Newton is not configured",
    "if config.sysid.require_newton is true, missing or low-confidence Newton output must fail"
  ],
  "quality_gate": {"min_score": 0.6},
  "human_required": false,
  "release_blocking": false,
  "real_robot": false
}
