{
  "id": "agentic_tuning_plan",
  "name": "Agentic Tuning Plan",
  "owner_agent": "autoresearch_agent",
  "description": "Convert measured gaps into bounded domain-randomization updates, action-scale candidates, hypotheses, and ranked experiments.",
  "implementation": "agentic_tuning_plan",
  "depends_on": ["physics_sysid"],
  "inputs": ["gap_estimates", "config.robot", "config.perception"],
  "outputs": ["agentic_tuning_plan.json", "subchecks/*/result.json", "result.json"],
  "validators": [
    "domain-randomization recommendations must stay within configured safety bounds",
    "action-scale candidates must include nominal scale and stay under the configured maximum",
    "AutoResearch plan must include bounded experiments and may promote only to human review"
  ],
  "quality_gate": {"min_score": 0.75},
  "human_required": false,
  "release_blocking": true,
  "real_robot": false
}
