{
  "id": "physics_sysid",
  "name": "Physics SysID",
  "owner_agent": "sysid_agent",
  "description": "Estimate actuator, latency, contact, uploaded video friction evidence, and optional physics-backend evidence from canonical real logs.",
  "implementation": "physics_sysid",
  "depends_on": ["real_data_evidence_gate"],
  "inputs": ["aligned_records", "uploaded_videos", "config.sysid", "config.robot", "config.video_evidence"],
  "outputs": ["physics_sysid.json", "subchecks/*/result.json", "subchecks/video_contact_friction/video_contact_friction.json", "result.json"],
  "validators": [
    "local log-based SysID must emit delay, deadband, and contact summaries",
    "uploaded contact, object, and gripper videos should emit friction and slip evidence when configured",
    "PACE and Newton backend adapters must consume canonical aligned records when enabled",
    "missing optional backend evidence must be recorded without blocking smoke runs",
    "required PACE or Newton evidence must fail when configured as mandatory"
  ],
  "quality_gate": {"min_score": 0.6},
  "human_required": true,
  "release_blocking": true,
  "real_robot": false
}
