{
  "id": "real_data_evidence_gate",
  "name": "Real Data Evidence Gate",
  "owner_agent": "evaluator_agent",
  "description": "Validate submitted real data and pose repeatability before SysID, agentic tuning, or release scoring trust the evidence.",
  "implementation": "real_data_evidence_gate",
  "depends_on": ["project_preflight"],
  "inputs": ["aligned_records", "calibration", "config.perception"],
  "outputs": ["real_data_evidence_gate.json", "subchecks/*/result.json", "result.json"],
  "validators": [
    "aligned records must include consistent action and joint dimensions",
    "minimum configured episode count must be present",
    "object pose estimate and reference fields must be populated",
    "pose repeatability must stay under the configured real-robot pose gate"
  ],
  "quality_gate": {"min_score": 0.7},
  "human_required": true,
  "release_blocking": true,
  "real_robot": false
}
