{
  "id": "env_preflight",
  "name": "Example Custom Environment Preflight",
  "owner_agent": "orchestrator_agent",
  "description": "Example replacement for the built-in environment preflight skill.",
  "implementation": "external_command",
  "runner": "command",
  "command": ["python3", "examples/custom_skills/env_preflight/run.py"],
  "timeout_s": 30,
  "depends_on": [],
  "inputs": ["config"],
  "outputs": ["custom_preflight.json", "result.json"],
  "validators": [
    "custom skill must write a valid skill result JSON",
    "custom skill must provide evidence"
  ],
  "quality_gate": {"min_score": 0.7},
  "human_required": false,
  "release_blocking": true,
  "real_robot": false
}

