{
  "id": "isaaclab_rollout_regression",
  "name": "Isaac Lab Rollout Regression",
  "owner_agent": "critic_agent",
  "description": "Run or consume true Isaac Lab rollout metrics for the release candidate policy before human hardware review.",
  "implementation": "isaaclab_rollout_regression",
  "depends_on": ["sim_eval_regression"],
  "inputs": ["config.isaac_lab.rollout_command", "config.isaac_lab.rollout_metrics_path", "skill_results"],
  "outputs": ["isaaclab_rollout_regression.json", "isaaclab_rollout_output.json", "result.json"],
  "validators": [
    "release-candidate profile must provide true Isaac Lab rollout evidence or an explicit waiver",
    "rollout success rate must meet the configured floor",
    "rollout contact force and pose error must stay under configured gates"
  ],
  "quality_gate": {"min_score": 0.7},
  "human_required": false,
  "release_blocking": true,
  "real_robot": false
}
